Вопрос,Правильный,Неверный1,Неверный2,Неверный3,Картинка
Как называется зона стабильной телепортации (L1 L2) в космосе?,Точка Лагранжа,Орбитальный резонанс,Гравитационный колодец,Энергетический барьер,lagrange_point.jpg
Какой русский ученый открыл возможность реактивного движения в космосе?,Константин Циолковский,Фридрих Цандер,Юрий Кондратюк,Михаил Тихонравов,tsiolkovsky.jpg
Как называются кольца Юпитера?,Гало и паутинные,Кольца Шекспира,Кольца Галилея,Кольца Юноны,jupiter_rings_halo.jpg
Какой спутник Нептуна вращается в обратном направлении и является крупнейшим ретроградным?,Тритон,Нереида,Протей,Лариса,triton_retrograde.jpg
Как называется путь по которому движутся кометы из Облака Оорта?,Гиперболическая орбита,Эллиптическая орбита,Параболическая орбита,Хаотический маршрут,hyperbolic_orbit.jpg
Какое событие породило Луну (гипотеза)?,Гигантское столкновение с Тейей,Гравитационный захват,Разрыв от Земли,Совместное формирование,giant_impact_theia.jpg
Как называется самый тяжелый спутник Сатурна (имеет атмосферу)?,Титан,Рея,Диона,Тефия,titan_atmosphere.jpg
Какая страна имеет ракету "Falcon 9" с возвращаемой первой ступенью?,США (SpaceX),Россия,Китай,Индия,falcon9_landing.jpg
Где находится самый большой ударный кратер на Меркурии?,Равнина Жары (Caloris Basin),Море Холода,Кратер Коперник,Бассейн Южный полюс,caloris_basin.jpg
Как называется последняя стадия жизни звезды типа Солнца?,Белый карлик,Чёрная дыра,Нейтронная звезда,Красный гигант,white_dwarf.jpg
Сколько времени длится день на Венере (звездные сутки)?,243 земных дня,24 часа,10 часов,365 дней,venus_day_length.jpg
Какой космический зонд пролетел мимо Плутона в 2015 году?,Новые Горизонты (New Horizons),Вояджер-2,Кассини,Пионер-10,new_horizons_pluto.jpg
Какой элемент атмосферы Марса доминирует?,Углекислый газ (95%),Азот,Аргон,Кислород,mars_atmosphere_co2.jpg
Как называется аппарат севший на Титан (спутник Сатурна) в 2005 году?,Гюйгенс,Филы,Битл,Шмель,huygens_titan.jpg
Какой у космонавтов прибор для туалета в невесомости называется?,АСУ (ассенизационная установка),Утилизатор,Вакуумный сборник,Накопитель,asu_space_toilet.jpg
Какой астероид является самым большим в Главном поясе?,Церера,Веста,Паллада,Гигея,ceres_asteroid.jpg
Какая планета видна с Земли наиболее ярко?,Венера,Юпитер,Марс,Меркурий,venus_brightest.jpg
Как называется космический корабль для лунной программы "Артемида"?,Орион,Аполлон,Starship HLS,ЛМ,orion_spacecraft.jpg
Что такое "черное небо" на Луне?,Отсутствие атмосферы, поэтому небо всегда черное,Лунная ночь,Тень от Земли,Реголит,dark_sky_moon.jpg
Какой спутник Марса падает на планету через 50 млн лет?,Фобос,Деймос,Никто,Тривия,phobos_decaying.jpg
Какая орбита позволяет спутнику "висеть" над одной точкой Земли?,Геостационарная орбита,Низкая опорная,Полярная,Высокоэллиптическая,geostationary.jpg
Как звали собаку летавшую в космос на "Спутнике-2"?,Лайка,Белка,Стрелка,Звездочка,laika_dog.jpg
Как называются старые звездные скопления сферической формы?,Шаровые скопления,Открытые скопления,Ассоциации звезд,Сверхскопления,globular_cluster_old.jpg
Какая атмосфера у спутника Сатурна - Титана?,Азотно-метановая,Кислородная,Углекислая,Гелиевая,titan_atmosphere_nitrogen.jpg
Какой современный телескоп заменил Хаббл в инфракрасном диапазоне?,James Webb Space Telescope,WFIRST,Euclid,Spektr-РГ,jwst_infrared.jpg
Какой тип комет имеет короткий период (менее 200 лет)?,Короткопериодические,Долгопериодические,Параболические,Гиперболические,short_period_comet.jpg
Сколько основных модулей у МКС?,16,5,32,40,iss_modules.jpg
Какая планета имеет систему колец открытую только в 1977 году?,Уран,Юпитер,Сатурн,Нептун,uranus_rings.jpg
Как называется группа звезд образующая фигуру но не являющаяся созвездием?,Астеризм,Кластер,Группировка,Ожерелье,asterism.jpg
Какой российский астронавт (ЕКА) летал на "Союзе"?,Тома Песке,Тимоти Пик,Саманта Кристофоретти,Андреас Могенсен,thomas_pesquet.jpg
Как называется самый активный вулкан на Ио?,Локи,Пеле,Ра,Аматэрасу,loki_io.jpg
Какой объект был извергнут из Солнечной системы (пояс Койпера)?,Oumuamua,Кавела,Аррокот,Седна,oumuamua.jpg
Как называется аппарат "Чандраян-3" (Индия)?,Лунный посадочный модуль,Марсианский орбитер,Солнечный зонд,Астероидный перехватчик,chandrayaan3.jpg
Какой известный астероид упал в Сибири в 1908 году?,Тунгусский метеорит,Челябинский,Сихотэ-Алинский,Витимский,tunguska_1908.jpg
Как называется светящаяся голова кометы?,Кома,Ядро,Хвост,Ореол,coma_comet.jpg
Какой отечественный ракетный двигатель используют на "Союзе-2"?,РД-107А/108А,РД-180,РД-170,РД-191,rd107_soyuz.jpg
Как называется граница гелиосферы где солнечный ветер сталкивается с межзвездной средой?,Гелиопауза,Терминационный шок,Ударная волна,Гравитационный барьер,heliopause.jpg
Какой спутник Юпитера самый большой (имеет собственное магнитное поле)?,Ганимед,Каллисто,Европа,Ио,ganymede_magnetic.jpg
Какая космическая обсерватория NASA изучает черные дыры в рентгене?,Чандра (Chandra),XMM-Newton,NuSTAR,Swift,chandra_observatory.jpg
Как звали первого американского астронавта в космосе?,Алан Шепард (суборбитальный),Джон Гленн,Нил Армстронг,Базз Олдрин,alan_shepard.jpg
Какой газовый гигант открыл Уильям Гершель в 1781 году?,Уран,Нептун,Юпитер,Сатурн,uranus_herschel.jpg
Как называются ледяные гейзеры на спутнике Энцеладе?,Криовулканы,Гейзеры Лейлы,Аммиачные фонтаны,Ледяные выбросы,cryovolcano_enceladus.jpg
Какая страна построила телескоп FAST (500 м сфера)?,Китай,США,Россия,Германия,fast_telescope.jpg
Что такое "ультрафиолетовое свечение" атмосферы Земли из космоса?,Геокорона,Сияние,Свечение Дейли,Аэрозольный слой,geocorona.jpg
Какой тип орбиты у спутников "GPS"?,Средняя околоземная (MEO, 20 200 км),Геостационарная,Низкая опорная,Высокоэллиптическая,gps_meo.jpg
Какой отечественный модуль МКС создан для исследований и шлюзов?,"Поиск" (МИМ-2),"Рассвет","Пирс" (затоплен),"Звезда",poisk_module.jpg
Какой самый маленький спутник из четырех галилеевых у Юпитера?,Европа,Ио,Ганимед,Каллисто,europa_smallest_galilean.jpg
Какая звезда с наименьшей массой называется?,Красный карлик,Белый карлик,Нейтронная звезда,Коричневый карлик,red_dwarf_lowest.jpg
Как называется режим полета при прохождении атмосферы Земли?,Аэродинамический тормоз,Глиссирование,Планирование,Суборбитальный,aerobraking.jpg
Какой американский шаттл разбился в 1986 году?,"Челленджер","Колумбия","Дискавери","Атлантис",challenger_shuttle.jpg
Как звали первого космонавта вышедшего в открытый космос из Китая?,Чжай Чжиган,Ян Ливэй,Лю Ян,Фэй Цзюньлун,zhai_zhigang.jpg
Какой тип планет называют "суперземлями"?,Экзопланета с массой 1-10 масс Земли,Газовый гигант,Ледяной гигант,Планета-океан,superearth_exoplanet.jpg
Как называется гигантское облако газа из которого рождаются звезды?,Молекулярное облако,Темная туманность,Ионизированный водород,Планетарная туманность,molecular_cloud.jpg
Какой космический корабль имел катастрофу во время миссии "Аполлон-13"?,Взрыв кислородного бака,Разрыв теплозащиты,Столкновение с астероидом,Отказ парашюта,apollo13_oxygen.jpg
Как называется орбитальная станция Китая?,"Тяньгун" (Небесный дворец),"Шэньчжоу","Тяньчжоу","Мяньянг",tiangong_station.jpg
Какая миссия NASA впервые сфотографировала Землю из космоса целиком ("Blue Marble")?,Аполлон-17,Аполлон-11,Вояджер-1,Спутник-1,blue_marble_apollo17.jpg
Какой элемент преобладает в атмосфере Венеры?,Углекислый газ,Серная кислота,Азот,Аргон,venus_co2.jpg
Как называется небесная сфера на которую проецируются звезды?,Небесная сфера,Эклиптика,Галактический экватор,Небесный экватор,celestial_sphere.jpg
Какой тип темной материи исключительно горячий (релятивистский)?,Горячая темная материя (нейтрино),Холодная,Теплая,Бозонная,hot_dark_matter.jpg
Какой российский спутник впервые в мире сфотографировал черную дыру (совместно с EHT)?,Спектр-Р (Радиоастрон),Астрон,Гамма,Коронас,radioastron_eht.jpg
В каком городе находится Центр управления полетами в России?,Королёв (ЦУП),Москва,Химки,Жуковский,tsup_korolev.jpg
Сколько времени лететь до Плутона от Земли на зонде "Новые Горизонты"?,9.5 лет,1 год,20 лет,3 года,new_horizons_travel.jpg
Какой самый частотный гамма-телескоп (Fermi) открыл много пульсаров?,Fermi LAT,Спектр-РГ,INTEGRAL,AGILE,fermi_lat.jpg
Какой эффект замедляет время вблизи черной дыры?,Гравитационное замедление времени,Допплеровский сдвиг,Лоренцово сокращение,Эффект Панченко,time_dilation_black_hole.jpg
Как называется звезда максимально яркая, когда водород кончается?,Гигант,Сверхгигант,Карлик,Субкарлик,red_giant.jpg
Какой астрономический прибор обнаруживает нейтрино?,Нейтринный детектор (Super-Kamiokande, IceCube),Радиотелескоп,Оптический телескоп,Гравитационный детектор,super_kamiokande.jpg
Какой российский модуль на МКС самый старый ("Заря")?,Первый модуль (1998),Звезда,Поиск,Рассвет,zarya_module.jpg
Какая частная компания разрабатывает скафандры Axiom для Луны?,Axiom Space,SpaceX,Boeing,Blue Origin,axiom_spacesuit.jpg
Как называется астероид с высоким содержанием металлов (никель-железо)?,M-тип астероид,S-тип,C-тип,D-тип,m_type_asteroid.jpg
Какая планета имеет самую большую гору (Олимп)?,Марс,Земля,Венера,Меркурий,olympus_mars.jpg
Сколько по Земному времени длится год на Уране?,84 года,165 лет,12 лет,29 лет,uranus_year.jpg
Как называется второй по величине спутник Нептуна?,Протей,Тритон,Нереида,Лариса,proteus_moon.jpg
Какой зонд впервые пролетел мимо астероида Гаспра?,Галилео (NASA),Кассини,Вояджер-2,NEAR,galileo_gaspra.jpg
Какой тип звездных остатков имеет массу до 1.4 массы Солнца?,Белый карлик (предел Чандрасекара),Нейтронная звезда,Черная дыра,Бозонная звезда,chandrasekhar_limit.jpg
Как называются метеориты найденные в Антарктиде?,Антарктические метеориты,Ледяные метеориты,Глетчерные камни,Сидеролиты,antarctic_meteorite.jpg
Какая страна первой посадила зонд на обратную сторону Луны (Chang'e-4)?,Китай,Россия,США,Индия,change4_farside.jpg
Какой химический элемент даёт красный цвет туманностям?,Водород (H-альфа),Кислород,Азот,Гелий,h_alpha_nebula.jpg
Как звали собаку вернувшуюся из космоса невредимой?,Стрелка и Белка (обе),Лайка,Звездочка,Стрелка,strelka_belka.jpg
Как называется тип орбиты при которой спутник пересекает полюса?,Полярная,Экваториальная,Наклонная,Синхронная,polar_orbit.jpg
Какой российский космический телескоп изучает рентгеновские источники?,Спектр-РГ (eROSITA),Радиоастрон,Миллиметрон,Гамма-400,spektr_rg_erosita.jpg
Сколько астероидов с диаметром более 1 км находится в Солнечной системе (приблизительно)?,~1 миллион,10 000,100 миллионов,500,million_asteroids.jpg
Какой спутник Земли имеет систему LIDAR для картографии?,LRO,Lunar Reconnaissance Orbiter,Чандраян-1,Селена,lro_lidar.jpg
Как называется проект NASA по захвату астероида (был отменен)?,ARM (Asteroid Redirect Mission),DART,Hera,OSIRIS-REx,asteroid_redirect.jpg
Какой советский луноход работал дольше всех (Луноход-2)?,4 месяца,1 год,2 недели,2 года,lunokhod2_long.jpg
Какой космический аппарат прислал фото колец Нептуна в 1989 году?,Вояджер-2,Вояджер-1,Кассини,Новые Горизонты,voyager2_neptune.jpg
Как называется слой ионосферы отражающий радиоволны?,Кеннелли-Хевисайда,Тропопауза,Мезопауза,Экзосфера,kennelly_heaviside.jpg
Какое место по яркости на небе занимает Юпитер среди планет?,2-е,3-е,4-е,5-е,jupiter_brightness.jpg
Какой двигатель создаёт тягу на принципе отдачи газов?,Реактивный двигатель,Ионный,Плазменный,Фотонный,rocket_engine_reaction.jpg
Какой космический телескоп ищет экзопланеты транзитным методом?,TESS,Кеплер,Планк,Хаббл,tess_transit.jpg
Как называется российский проект многоразовой ракеты "Амур"?,"Амур-СПГ","Корона","Малахит","Феникс",amur_spg.jpg
Сколько длится солнечный цикл активности?,11 лет,22 года,1 год,100 лет,solar_cycle_11.jpg
Какой элемент доминирует на Церере?,Вода и глинистые минералы,Железо,Кремний,Магний,ceres_water.jpg
Как называется бортпроводник в космосе (профессия)?,Бортинженер,Космический турист,Командир,Специалист миссии,flight_engineer.jpg
Какой модуль стал первым жилым на МКС (российский)?,Звезда,Заря,Поиск,Рассвет,zvezda_module.jpg
Какой газовый гигант наиболее близок к Солнцу по составу?,Юпитер,Сатурн,Уран,Нептун,jupiter_sun_composition.jpg
Как называется результат столкновения галактик?,Галактическое слияние,Вспышка звездообразования,Эллиптическая галактика,Балдж,galactic_merger.jpg
Какой космический аппарат сфотографировал Землю как "бледно-синюю точку"?,Вояджер-1 (1990),Вояджер-2,Пионер-11,Кассини,pale_blue_dot.jpg
Какой элемент использован в ранцах маневрирования астронавтов (MMU)?,Сжатый азот,Кислород,Водород,Гелий,mmu_nitrogen.jpg
Сколько лун у Сатурна (подтвержденных на 2024 год)?,146,82,53,100+,saturn_moons_146.jpg
Как называется знаменитый кратер на Земле от огромного астероида (в Мексике)?,Чикшулуб,Баррингер,Вредефорт,Маникуаган,chicxulub_crater.jpg
Какой американский астронавт провел в космосе 371 день суммарно?,Скотт Келли,Пегги Уитсон,Крис Хэдфилд,Базз Олдрин,scott_kelly.jpg
Как называется самый яркий квазар в ультрафиолете?,3C 273,TON 618,APM 08279+5255,PG 0052+251,uv_quasar_3c273.jpg
Кто был первым человеком в космосе?,Юрий Гагарин,Герман Титов,Нил Армстронг,Алексей Леонов,gagarin_first.jpg
Как назывался космический корабль Юрия Гагарина?,Восток-1,Восход-1,Союз-1,Восток-2,vostok1_spacecraft.jpg
В каком году был запущен первый искусственный спутник Земли?,1957,1956,1958,1955,sputnik_1957.jpg
Кто был главным конструктором советской ракетно-космической техники?,Сергей Королёв,Валентин Глушко,Владимир Челомей,Михаил Янгель,korolev_designer.jpg
Кто была первая в мире женщина-космонавт?,Валентина Терешкова,Светлана Савицкая,Елена Кондакова,Юлия Пересильд,tereshkova_first_woman.jpg
Какой космический корабль первым состыковался с другим в пилотируемом режиме?,Союз-4 и Союз-5,Аполлон и Союз,Джемини-8,Восток-3 и Восток-4,soyuz4_5_docking.jpg
Кто первым вышел в открытый космос?,Алексей Леонов,Эдвин Уайт,Юрий Гагарин,Владимир Комаров,leonov_spacewalk.jpg
Как назывался американский лунный модуль "Аполлона-11"?,Орел,Колумбия,Интрепид,Одиссей,eagle_lunar_module.jpg
Какой американский астронавт сделал знаменитую фразу "Это один маленький шаг..."?,Нил Армстронг,Базз Олдрин,Майкл Коллинз,Пит Конрад,armstrong_step.jpg
В каком году произошла катастрофа "Аполлона-13"?,1970,1969,1971,1968,apollo13_1970.jpg
Как называлась последняя миссия человека на Луну?,Аполлон-17,Аполлон-16,Аполлон-15,Аполлон-14,apollo17_last.jpg
Кто был первым космонавтом совершившим полет в космос более одного раза?,Герман Титов,Юрий Гагарин,Владимир Комаров,Павел Попович,titov_twice.jpg
Как называется знаменитый советский (российский) спускаемый аппарат используемый до сих пор?,Союз,Восток,Восход,Прогресс,soyuz_capsule.jpg
Как называлась американская программа доставки человека на Луну?,Аполлон,Меркурий,Джемини,Артемида,apollo_program.jpg
Какой американский астронавт был первым кто вышел в открытый космос (США)?,Эдвин Уайт,Нил Армстронг,Базз Олдрин,Джон Гленн,ed_white_eva.jpg
Какая ракета-носитель использовалась для программы "Аполлон"?,Сатурн-5,Сатурн-1B,Титан-II,Атлас-В,saturn5_rocket.jpg
Как назывался советский аналог "Спейс Шаттла"?,Буран,Молния,Энергия,Байкал,buran_shuttle.jpg
Кто был первым космонавтом из Германии на советском корабле?,Зигмунд Йен,Томас Райтер,Ульф Мербольд,Александр Герст,jaehn_germany.jpg
Какой космический корабль доставил на МКС первый модуль "Заря"?,Спейс Шаттл "Индевор",Союз,Протон,Атлантис,endeavour_zarya.jpg
Кто был самым молодым космонавтом в истории (25 лет)?,Герман Титов,Юрий Гагарин,Владимир Комаров,Валентина Терешкова,titov_youngest.jpg
Какая станция была первой в мире долговременной орбитальной станцией?,Салют-1,Скайлэб,Мир,МКС,salyut1.jpg
В каком году была запущена станция "Мир"?,1986,1971,1973,1990,mir_1986.jpg
