Вопрос,Правильный,Неверный1,Неверный2,Неверный3,Картинка
Как звали самого опытного космонавта (6 полетов и 803 дня в космосе)?,Сергей Крикалёв,Геннадий Падалка,Юрий Маленченко,Фёдор Юрчихин,krikalev_record.jpg
Какой космический аппарат был первым достигшим Луны (жесткая посадка)?,Луна-2,Луна-1,Луна-3,Луна-9,luna2_first_hard_landing.jpg
Какая страна запустила первый геостационарный спутник (Syncom-2)?,США,СССР,Китай,Франция,syncom2_usa.jpg
Как называется российский грузовой корабль для МКС?,Прогресс,Союз,Протон,Заря,progress_cargo.jpg
Кто был первым космонавтом совершившим выход в космос из станции "Мир"?,Владимир Титов,Муса Манаров,Александр Серебров,Леонид Кизим,titov_mir_spacewalk.jpg
Какой космический челнок (шаттл) первым совершил полет в 1981 году?,Колумбия,Атлантис,Дискавери,Индевор,columbia_sts1.jpg
Какой шаттл взорвался при старте в 1986 году?,Челленджер,Колумбия,Атлантис,Индевор,challenger_1986.jpg
Какой шаттл разбился при посадке в 2003 году?,Колумбия,Челленджер,Дискавери,Атлантис,columbia_2003.jpg
Как звали первого астронавта-афроамериканца (сша)?,Гай Блуфорд,Майкл Андерсон,Бенджамин Дэвис,Рональд Макнейр,bluford_african.jpg
Как звали первого астронавта-китайца в космосе?,Ян Ливэй,Чжай Чжиган,Лю Ян,Фэй Цзюньлун,yang_liwei.jpg
Какая миссия "Аполлон" была неудачной и не села на Луну из-за взрыва?,Аполлон-13,Аполлон-12,Аполлон-10,Аполлон-14,apollo13_failure.jpg
Какой космонавт был первым кто управлял транспортным кораблем вручную (Союз-1)?,Владимир Комаров,Юрий Гагарин,Алексей Леонов,Павел Беляев,komarov_manual.jpg
Кто был первым космонавтом погибшим при выполнении полета (Союз-1)?,Владимир Комаров,Юрий Гагарин,Павел Беляев,Григорий Нелюбов,komarov_death.jpg
Как назывался первый пилотируемый корабль США?,Меркурий-Редстоун-3 (Freedom 7),Джемини-3,Аполлон-1,Меркурий-Атлас-6,mercury_freedom7.jpg
Как звали первого астронавта США на орбите (три витка)?,Джон Гленн,Алан Шепард,Скотт Карпентер,Уолли Ширра,glenn_orbital.jpg
Кто был первым космонавтом выполнившим стыковку в космосе (вручную)?,Алексей Елисеев и Евгений Хрунов,Владимир Шаталов,Борис Волынов,Георгий Береговой,eliseev_docking.jpg
Как называется российский скафандр для выхода в открытый космос?,Орлан,Сокол,Беркут,Кречет,orlan_spacesuit.jpg
Какой американский скафандр использовался на Луне?,A7L (Apollo),EMU,Sokol,Orlan,a7l_spacesuit.jpg
Какая ракета-носитель самая мощная из когда-либо успешно запущенных?,Сатурн-5,Энергия,SLS (Block 1),Falcon Heavy,saturn5_most_powerful.jpg
Как назывался советский проект по многоразовой системе "Буран"?,Энергия-Буран,Молния,Спираль,Заря,energia_buran.jpg
Кто был первым космонавтом совершившим полет без скафандра?,Владимир Комаров (Союз-1),Юрий Гагарин (Восток-1),Герман Титов,Павел Попович,komarov_no_suit.jpg
Как назывался первый лунный ровер доставленный на Луну?,Луноход-1 (СССР),LRV (Аполлон),Лунный вездеход,Селеноход,lunokhod1_first.jpg
Какой космический аппарат первым совершил мягкую посадку на Луне?,Луна-9,Луна-2,Луна-10,Сервейер-1,luna9_soft_landing.jpg
Как называлась программа СССР по отправке человека на Луну?,Н1-Л3,УР-500К,Зонд,Союз 7К-Л1,n1_l3_program.jpg
Кто был главным конструктором "лунной гонки" в США?,Вернер фон Браун,Роберт Годдард,Джин Кранц,Кристофер Крафт,von_braun.jpg
Как назывались тестовые беспилотные полеты "Союза" для отработки стыковки?,Космос-186/188,Космос-212/213,Союз-2/3,Союз-3,cosmos186_188.jpg
Какой советский космический корабль мог нести 3 космонавта без скафандров?,Восход,Восток,Союз,Прогресс,voskhod_3crew.jpg
Какая женщина-космонавт совершила выход в открытый космос?,Светлана Савицкая,Валентина Терешкова,Елена Кондакова,Анна Кикина,savitskaya_spacewalk.jpg
Как звали первую американскую женщину в космосе?,Салли Райд,Кэтрин Салливан,Мэй Джемисон,Пэгги Уитсон,sally_ride_first.jpg
Кто был первым космонавтом запущенным с космодрома "Плесецк"?,Георгий Береговой,Владимир Шаталов,Борис Волынов,Павел Попович,beregovoy_plesetsk.jpg
Как называлась американская программа пилотируемых полетов до "Аполлона"?,Джемини,Меркурий,Орион,Артемида,gemini_program_before.jpg
Какой астронавт играл в гольф на Луне?,Алан Шепард (Аполлон-14),Нил Армстронг,Эдвин Олдрин,Чарльз Дьюк,shepard_golf.jpg
Как звали самого пожилого космонавта в космосе?,Джон Гленн (77 лет, STS-95),Пегги Уитсон,Скотт Келли,Юрий Гагарин,glenn_oldest.jpg
Какой космический корабль называется "Клипер" (проект)?,Многоразовый корабль РКК Энергия,Dream Chaser,Starship,Орел,clipper_russia.jpg
Какой индийский зонд обнаружил воду на Луне в 2008 году?,Чандраян-1,Чандраян-2,Мангальян,Чандраян-3,chandrayaan1_water.jpg
Как назывались две собаки успешно вернувшиеся из космоса?,Белка и Стрелка,Лайка и Звездочка,Жулька и Альфа,Ветерок и Уголек,belka_strelka.jpg
Какой космонавт пробыл в космосе 803 дня суммарно (рекорд до 2024 года)?,Геннадий Падалка,Сергей Крикалёв,Валерий Поляков,Юрий Маленченко,padalka_803days.jpg
Какой корабль доставил на Землю первых космонавтов после высадки на Луну (Аполлон-11)?,Командный модуль "Колумбия",Лунный модуль "Орел",Шаттл,Союз,columbia_cm.jpg
Как называется орбитальный модуль созданный компанией SpaceX для туристов?,Crew Dragon,Starship,Dragon XL,Dragon 2,crew_dragon.jpg
Какой российский скафандр используется внутри корабля "Союз"?,Сокол,Орлан,Беркут,Стриж,sokol_spacesuit.jpg
Кто был первым космонавтом отметившим день рождения в космосе?,Юрий Гагарин,Герман Титов,Валентина Терешкова,Владимир Комаров,titov_birthday.jpg
Какой космонавт-художник рисовал в космосе (первый)?,Алексей Леонов,Юрий Гагарин,Геннадий Падалка,Сергей Рязанский,leonov_painter.jpg
В каком году состоялась стыковка "Союз-Аполлон" (ЭПАС)?,1975,1972,1978,1981,epas_1975.jpg
Как назывался первый ядерный ракетный двигатель (СССР)?,РД-0410,НК-33,РД-180,ЯРД-1,rd0410_nuclear.jpg
Какая российская ракета-носитель использует метан (проект)?,Амур-СПГ,Ангара-А5В,Союз-5,Енисей,amur_spg_methane.jpg
Кто из американских астронавтов имеет наибольшее суммарное время в космосе?,Пегги Уитсон (675 дней),Скотт Келли,Крис Хэдфилд,Джон Гленн,whitson_record.jpg
Какой советский космический аппарат впервые сфотографировал обратную сторону Луны?,Луна-3,Луна-2,Луна-1,Луна-10,luna3_farside.jpg
Как называется российский космический буксир (ядерный)?,Зевс (Транспортно-энергетический модуль),Гром,Атом,Феникс,zeus_nuclear_tug.jpg
Какой американский разгонный блок использовался для доставки зондов к планетам?,Центавр (Centaur),Фрегат,Бриз-М,Стар-48,centaur_upper.jpg
Кто был первым космонавтом женившимся после полета но обручившимся по радио?,Юрий Гагарин,Алексей Леонов,Герман Титов,Павел Беляев,titov_radio_wedding.jpg
Как называется технология "возврат первой ступени" от SpaceX?,Пропульсивная посадка,Аэродинамический спуск,Парашютная система,Автономное возвращение,propulsive_landing.jpg
Какой двигатель установлен на первой ступени Falcon 9?,Merlin 1D,Raptor,BE-4,RD-180,merlin1d_engine.jpg
Какая ракета SpaceX полностью многоразовая (в разработке)?,Starship,Falcon Heavy,Falcon 9,Dragon,starship_fully_reusable.jpg
Как звали американского астронавта который потерял перчатку во время выхода?,Эдвард Уайт,Брюс Маккэндлесс,Майкл Коллинз,Юджин Сернан,white_glove_loss.jpg
Какая собака была первой отправившейся в космос и погибшей?,Лайка (Спутник-2),Стрелка,Белка,Жучка,laika_death.jpg
Какой российский лунный посадочный модуль разрабатывается для миссии "Луна-27"?,Луна-27 (посадочный),Луна-25,Луна-26,Луна-28,luna27_lander.jpg
Кто был первым астронавтом Европейского космического агентства (ЕКА)?,Ульф Мербольд (Германия),Томас Райтер,Клод Николье,Жан-Франсуа Клервуа,merbold_esa.jpg
Какой корабль выполнил спасение экипажа МКС в 2023 году (замена "Союза")?,SpaceX Crew Dragon (Crew-5),Союз МС-22,Прогресс,Белый лебедь,dragon_rescue.jpg
Как называется прибор для дозиметрии на МКС?,Дозиметр,Радиометр,Спектрометр,Детектор,dosimeter_iss.jpg
Какой космический аппарат НАСА сейчас летит к Европе (спутник Юпитера)?,Europa Clipper,JUICE,Галилео,Кассини,europa_clipper.jpg
Какая китайская миссия доставила грунт с обратной стороны Луны?,Чанъэ-6,Чанъэ-5,Чанъэ-4,Чанъэ-7,change6_sample.jpg
Какой рекорд скорости принадлежит пилотируемому кораблю "Аполлон-10"?,39 896 км/ч,28 000 км/ч,40 000 км/ч,35 000 км/ч,apollo10_speed_record.jpg
Какой американский астронавт сделал "фото Земли с Луны" (Earthrise)?,Уильям Андерс (Аполлон-8),Нил Армстронг,Базз Олдрин,Фрэнк Борман,anders_earthrise.jpg
Как называется российский проект сверхтяжелой ракеты "Енисей"?,Был отменен в 2021 году,Энергия-5В,Союз-7,Амур-СПГ,yenisei_cancelled.jpg
Кто был первым космонавтом совершившим полет на "Восходе-2"?,Павел Беляев и Алексей Леонов,Павел Беляев, Алексей Леонов,Владимир Комаров,Георгий Береговой,voskhod2_crew.jpg
Как называется двигатель разработки Blue Origin?,BE-4,Raptor,Merlin,RD-180,be4_engine.jpg
Какой параметр измеряет "гравиметрическая карта" от GRACE?,Гравитационное поля,Магнитное поле,Сейсмическую активность,Климат,grace_gravity.jpg
Какой самый тяжелый искусственный спутник находится на орбите Земли (~450 тонн)?,МКС,Хаббл,Спектр-РГ,Envisat,iss_heaviest.jpg
Как называется российский многофункциональный лабораторный модуль пристыкованный к МКС в 2021 году?,Наука,Причал,Рассвет,Звезда,nauka_2021.jpg
Какой космический корабль "Прогресс" имеет грузоподъемность ~2.5 тонны?,Прогресс МС,Прогресс М,Прогресс М1,Прогресс М2,progress_ms_cargo.jpg
Кто был первым космонавтом - дважды Героем Советского Союза (посмертно)?,Владимир Комаров,Юрий Гагарин,Алексей Леонов,Герман Титов,komarov_twice.jpg
Какой космодром находится в Амурской области (Россия)?,Восточный,Плесецк,Байконур,Капустин Яр,vostochny_cosmodrome.jpg
Какой спутник был запущен первым в мире с завода "Арсенал"?,Космос-1,Спутник-1,Спутник-2,Протон-1,cosmos1_arsenal.jpg
Какие США астронавты работали с советской станцией "Мир" (программа "Мир-Шаттл")?,Норман Тагард, Шеннон Лучид и др.,Джон Гленн,Нил Армстронг,Салли Райд,tagard_mir.jpg
Какой космический аппарат первым провел гравитационный маневр у Юпитера?,Пионер-10,Вояджер-1,Вояджер-2,Пионер-11,pioneer10_gravity.jpg
Как называется спутник "Луна-25" разбившийся в 2023 году?,Российский посадочный модуль,Индийский зонд,Китайский луноход,Американский орбитер,luna25_crash.jpg
Какой американский корабль "Орион" совершил беспилотный облет Луны (Artemis I)?,Орион,Аполлон,Артемида,Одиссей,orion_artemis1.jpg
Какой российский космонавт беспилотно управлял кораблем "Союз МС-18"?,Олег Новицкий,Сергей Рыжиков,Антон Шкаплеров,Пётр Дубров,novitsky_remote.jpg
Как звали первого астронавта который вышел в отрытый космос без привязи (MMU)?,Брюс Маккэндлесс,Роберт Гибсон,Джозеф Аллен,Дейл Гарднер,mccandless_free_floating.jpg